{
  "schema": "gator-session-snippet-v2",
  "type": "session_snippet",
  "architect": "Alan Gillette",
  "agent": "codex",
  "intent": "Housekeeping: record completed Welcome planning and coding loops",
  "change_type": "maintenance",
  "significance": "routine",
  "charter_changed": false,
  "decision_tags": [
    "loop",
    "welcome",
    "housekeeping"
  ],
  "commit": "c65bf151c52567e3308d36fcce48a121021b1d69",
  "short_commit": "c65bf15",
  "snippet_id": "snippet-c65bf151c5256",
  "session_group_key": "anthropic:a30045bd-18cf-4627-a735-1fbfeb7489b2",
  "repo": "gator",
  "branch": "dev",
  "commit_index": 2,
  "previous_commit_in_session": "8fd63ef17e76bbc967d06ee260fa0710f0edfab9",
  "started_at": "2026-10-11T12:48:31Z",
  "ended_at": "2026-10-11T13:01:17Z",
  "vendor_inferred": "anthropic",
  "model_inferred": "claude-opus-5-5",
  "machine_id": "c5c707f5-155a-422f-9b1b-d9e8a10fea08",
  "machine_label": "alan-home-desktop",
  "files_touched": [
    ".gator/.gator-version",
    ".gator/loops/dashboard-welcome-workspace-2026-10-10T19-50-19Z/events.jsonl",
    ".gator/loops/dashboard-welcome-workspace-2026-10-10T19-50-19Z/findings.current.md",
    ".gator/loops/dashboard-welcome-workspace-2026-10-10T19-50-19Z/findings.round-0.md",
    ".gator/loops/dashboard-welcome-workspace-2026-10-10T19-50-19Z/plan.current.md",
    ".gator/loops/dashboard-welcome-workspace-2026-10-10T19-50-19Z/plan.round-0.md",
    ".gator/loops/dashboard-welcome-workspace-2026-10-10T19-50-19Z/session.json",
    ".gator/loops/dashboard-welcome-workspace-2026-10-10T19-50-19Z/sketch.md",
    ".gator/loops/dashboard-welcome-workspace-2026-10-10T19-59-24Z/approved-plan.md",
    ".gator/loops/dashboard-welcome-workspace-2026-10-10T19-59-24Z/events.jsonl",
    ".gator/loops/dashboard-welcome-workspace-2026-10-10T19-59-24Z/findings.current.md",
    ".gator/loops/dashboard-welcome-workspace-2026-10-10T19-59-24Z/findings.round-0.md",
    ".gator/loops/dashboard-welcome-workspace-2026-10-10T19-59-24Z/findings.round-1.md",
    ".gator/loops/dashboard-welcome-workspace-2026-10-10T19-59-24Z/findings.round-2.md",
    ".gator/loops/dashboard-welcome-workspace-2026-10-10T19-59-24Z/findings.round-3.md",
    ".gator/loops/dashboard-welcome-workspace-2026-10-10T19-59-24Z/findings.round-4.md",
    ".gator/loops/dashboard-welcome-workspace-2026-10-10T19-59-24Z/implementation.current.md",
    ".gator/loops/dashboard-welcome-workspace-2026-10-10T19-59-24Z/implementation.round-0.md",
    ".gator/loops/dashboard-welcome-workspace-2026-10-10T19-59-24Z/implementation.round-1.md",
    ".gator/loops/dashboard-welcome-workspace-2026-10-10T19-59-24Z/implementation.round-2.md",
    ".gator/loops/dashboard-welcome-workspace-2026-10-10T19-59-24Z/implementation.round-3.md",
    ".gator/loops/dashboard-welcome-workspace-2026-10-10T19-59-24Z/implementation.round-4.md",
    ".gator/loops/dashboard-welcome-workspace-2026-10-10T19-59-24Z/session.json",
    ".gator/loops/welcome-html-documents-2026-10-11T00-15-22Z/events.jsonl",
    ".gator/loops/welcome-html-documents-2026-10-11T00-15-22Z/findings.current.md",
    ".gator/loops/welcome-html-documents-2026-10-11T00-15-22Z/findings.round-0.md",
    ".gator/loops/welcome-html-documents-2026-10-11T00-15-22Z/findings.round-1.md",
    ".gator/loops/welcome-html-documents-2026-10-11T00-15-22Z/plan.current.md",
    ".gator/loops/welcome-html-documents-2026-10-11T00-15-22Z/plan.round-0.md",
    ".gator/loops/welcome-html-documents-2026-10-11T00-15-22Z/plan.round-1.md",
    ".gator/loops/welcome-html-documents-2026-10-11T00-15-22Z/session.json",
    ".gator/loops/welcome-html-documents-2026-10-11T00-15-22Z/sketch.md",
    ".gator/loops/welcome-html-documents-2026-10-11T00-26-12Z/approved-plan.md",
    ".gator/loops/welcome-html-documents-2026-10-11T00-26-12Z/events.jsonl",
    ".gator/loops/welcome-html-documents-2026-10-11T00-26-12Z/findings.current.md",
    ".gator/loops/welcome-html-documents-2026-10-11T00-26-12Z/findings.round-0.md",
    ".gator/loops/welcome-html-documents-2026-10-11T00-26-12Z/findings.round-1.md",
    ".gator/loops/welcome-html-documents-2026-10-11T00-26-12Z/implementation.current.md",
    ".gator/loops/welcome-html-documents-2026-10-11T00-26-12Z/implementation.round-0.md",
    ".gator/loops/welcome-html-documents-2026-10-11T00-26-12Z/implementation.round-1.md",
    ".gator/loops/welcome-html-documents-2026-10-11T00-26-12Z/session.json",
    ".gator/runtime-pin.json",
    ".gator/session-snippets/2026-10-11-gator-8fd63ef17e76b.json"
  ],
  "notes": [
    "Records the approved Dashboard Welcome workspace and Welcome HTML-document planning and implementation loops.",
    "Advances the local Gator runtime pin and version marker to the installed 2.24.0 runtime."
  ],
  "transcript_session_id": "a30045bd-18cf-4627-a735-1fbfeb7489b2",
  "transcript_ref": null
}