{
  "schema": "gator-session-snippet-v2",
  "type": "session_snippet",
  "architect": "alan",
  "agent": "opus-4-7",
  "intent": "Roll forward roadmap + inbox — Cumberland HTML Sketch 2 arc closed",
  "change_type": "docs",
  "significance": "routine",
  "charter_changed": false,
  "decision_tags": [
    "governance-roll-forward",
    "cumberland-html",
    "sketch-2-closed"
  ],
  "commit": "da0f112a26cca1efd63e8b0714b9f39a406dd43e",
  "short_commit": "da0f112",
  "snippet_id": "snippet-da0f112a26cca",
  "session_group_key": "anthropic:c7e1ee37-9db5-4090-b03d-779ca7d3b713",
  "repo": "gator",
  "branch": "main",
  "commit_index": 7,
  "previous_commit_in_session": "d986898605fd8e8e83a79a72287cf6d4ea38c35a",
  "started_at": "2026-09-14T09:52:35Z",
  "ended_at": "2026-09-14T15:21:08Z",
  "vendor_inferred": "anthropic",
  "model_inferred": "claude-opus-4-7",
  "machine_id": "c5c707f5-155a-422f-9b1b-d9e8a10fea08",
  "machine_label": "alan-home-desktop",
  "files_touched": [
    ".gator/inbox.md",
    ".gator/roadmap.md",
    ".gator/session-snippets/2026-09-14-gator-d986898605fd8.json"
  ],
  "notes": [
    "Roll-forward pass after the Cumberland HTML Sketch 2 arc closed",
    "in `d986898` (Codex round-15: \"No findings. Recommend closure\").",
    "Prepended a summary of the Cumberland closure to the leading",
    "paragraph: 18 commits `fd35d92`..`d986898`, three days,",
    "eleven enforcer rounds → round-12 positive-policy pivot →",
    "rounds 13-14 wiring tightening. Not tied to a released",
    "version — ships with the next release.",
    "Version stamp bumped `2026-09-12` → `2026-09-14`."
  ],
  "transcript_session_id": "c7e1ee37-9db5-4090-b03d-779ca7d3b713",
  "transcript_ref": null
}