{
  "schema": "gator-session-snippet-v2",
  "type": "session_snippet",
  "architect": "Alan Gillette",
  "agent": "claude-opus-5-5",
  "intent": "Override dialog: accept pasted reasons, resizable field, 500-character reasons; approvals are Dashboard-first",
  "change_type": "fix",
  "significance": "routine",
  "charter_changed": "override-skip",
  "decision_tags": [
    "dashboard",
    "override",
    "governance"
  ],
  "commit": "870673338d5fd997a73a10bc940aa1b85d8e8408",
  "short_commit": "8706733",
  "snippet_id": "snippet-870673338d5fd",
  "session_group_key": null,
  "repo": "gator",
  "branch": "dev",
  "commit_index": 2,
  "previous_commit_in_session": "f658e51b90b29e5138a6d15a15f7913cc0bf817c",
  "started_at": "2026-10-29T15:33:13Z",
  "ended_at": "2026-10-29T15:33:13Z",
  "vendor_inferred": "anthropic",
  "model_inferred": "claude-opus-5-5",
  "machine_id": "c5c707f5-155a-422f-9b1b-d9e8a10fea08",
  "machine_label": "alan-home-desktop",
  "files_touched": [
    ".claude/commands/commit.md",
    ".gator/.includes/constitution.md",
    ".gator/.includes/procedures/architect-override.md",
    ".gator/charters/scripts-cross-cutting.md",
    ".gator/charters/scripts-dashboard-ui.md",
    ".gator/charters/scripts-dashboard.md",
    ".gator/charters/scripts-precommit.md",
    ".gator/session-snippets/2026-10-29-gator-f658e51b90b29.json",
    "enterprise/enterprise-cli/gator_enterprise_cli/bundled_scripts/gator-pre-commit.py",
    "enterprise/enterprise-cli/gator_enterprise_cli/bundled_scripts/precommit_override.py",
    "src/gator_command/scripts/dashboard/dashboard.css",
    "src/gator_command/scripts/dashboard/data.py",
    "src/gator_command/scripts/dashboard/views/history.js",
    "src/gator_command/templates/gator-starter/commands/commit.md",
    "src/gator_command/templates/gator-starter/constitution.md",
    "src/gator_command/templates/gator-starter/docs/pre-commit-checks.html",
    "src/gator_command/templates/gator-starter/procedures/architect-override.md",
    "src/gator_command/templates/gator-starter/scripts/gator-pre-commit.py",
    "src/gator_command/templates/gator-starter/scripts/precommit_override.py",
    "tests/test_dashboard_override.py",
    "tests/test_dashboard_ui/test_commits_block_ui.py"
  ],
  "notes": [
    "The blocked-commit dialog's reason field now accepts text pasted from a",
    "terminal: line breaks and tabs are folded to single spaces, as the",
    "single-line `Gator-Override-Reason` trailer would make them anyway, instead",
    "of being refused as control characters. Other control characters are still",
    "refused. The field resizes vertically again, and a reason may be up to 500",
    "characters (was 200) on every path: dialog, Dashboard relay and the",
    "approval CLI (`TRAILER_MAX`, byte-identical template and Enterprise copies).",
    "Approval guidance is now Dashboard-first. The hook's STOP box, the"
  ],
  "transcript_session_id": null,
  "transcript_ref": null
}