{
  "schema": "gator-session-snippet-v2",
  "type": "session_snippet",
  "architect": "ag",
  "agent": "claude-opus-4-6",
  "intent": "Dashboard loop workspace Modules 1–6 — enumeration API, resolver, events, read-only UI, start + prompt, Architect controls, executive summaries",
  "change_type": "feature",
  "significance": "notable",
  "charter_changed": true,
  "decision_tags": [
    "dashboard",
    "loop",
    "api"
  ],
  "commit": "bd95de37af25ab55a5c40d620cd2be668c61c7f0",
  "short_commit": "bd95de3",
  "snippet_id": "snippet-bd95de37af25a",
  "session_group_key": "anthropic:cb9a4c63-1bbc-404a-9255-3e500a30471b",
  "repo": "gator",
  "branch": "dev",
  "commit_index": 1,
  "previous_commit_in_session": null,
  "started_at": "2026-09-24T00:39:41Z",
  "ended_at": "2026-09-24T00:54:01Z",
  "vendor_inferred": "anthropic",
  "model_inferred": "claude-opus-4-6",
  "machine_id": "c5c707f5-155a-422f-9b1b-d9e8a10fea08",
  "machine_label": "alan-home-desktop",
  "files_touched": [
    ".claude/commands/loop-join.md",
    ".gator/.gator-version",
    ".gator/.includes/procedures/gator-loop-protocol.md",
    ".gator/.includes/reference-notes/loop-artifact-formats.md",
    ".gator/charters/INDEX.md",
    ".gator/charters/README.md",
    ".gator/charters/_template.md",
    ".gator/charters/contracts.md",
    ".gator/charters/release-pipeline.md",
    ".gator/charters/scripts-cross-cutting.md",
    ".gator/charters/scripts-dashboard-ui.md",
    ".gator/charters/scripts-dashboard.md",
    ".gator/charters/scripts-enterprise.md",
    ".gator/charters/scripts-fleet-intelligence.md",
    ".gator/charters/scripts-installer.md",
    ".gator/charters/scripts-layout.md",
    ".gator/charters/scripts-loop.md",
    ".gator/charters/scripts-managed-state.md",
    ".gator/charters/scripts-repo-lifecycle.md",
    ".gator/charters/scripts-session-archaeology.md",
    ".gator/commit_draft.md",
    ".gator/inbox.md",
    ".gator/roadmap.md",
    ".gator/runtime-pin.json",
    ".gator/session-snippets/2026-09-21-gator-7153cd4cd5745.json",
    "AGENTS.md",
    "CLAUDE.md",
    "GEMINI.md",
    "src/gator_command/scripts/dashboard/dashboard.css",
    "src/gator_command/scripts/dashboard/dashboard.html",
    "src/gator_command/scripts/dashboard/dashboard.js",
    "src/gator_command/scripts/dashboard/views/fleet.js",
    "src/gator_command/scripts/dashboard/views/loop.js",
    "src/gator_command/scripts/gator-dashboard.py",
    "src/gator_command/scripts/gatorize/entry_points.py",
    "src/gator_command/scripts/loop/host.py",
    "src/gator_command/scripts/loop/session.py",
    "src/gator_command/scripts/loop/submit.py",
    "src/gator_command/templates/gator-starter/commands/loop-join.md",
    "src/gator_command/templates/gator-starter/procedures/gator-loop-protocol.md",
    "src/gator_command/templates/gator-starter/reference-notes/loop-artifact-formats.md",
    "tests/test_dashboard_loops.py",
    "tests/test_dashboard_ui/_harness.py",
    "tests/test_dashboard_ui/conftest.py",
    "tests/test_dashboard_ui/test_loop_seed.py",
    "tests/test_dashboard_ui/test_loop_workspace.py",
    "tests/test_gatorize.py",
    "tests/test_loop.py"
  ],
  "notes": [
    "Add `_resolve_repo_by_key()` and `_resolve_loop_dir()` resolvers to `gator-dashboard.py` — shared gatekeepers for all loop workspace routes, with path-traversal rejection, symlink rejection, and structural parent containment (`in loop_dir.parents`, not string prefix)",
    "Add `_dispatch_loop_get()` router and two handlers: `_handle_loop_list()` (sorted by recency, symlinks skipped), `_handle_loop_status()` (allowlisted fields via `_LOOP_STATUS_ALLOWED_KEYS` — unknown/future fields silently dropped)",
    "Routes use `/api/repo-by-key/<repo_key>/loops/...` prefix, separate from existing name-addressed routes",
    "Create `tests/test_dashboard_loops.py` with 16 test cases: list empty, list with loops, inaccessible repo 404, two-repo isolation, status found, status not found, status on repo without .gator returns 404, status on repo without loops dir returns 404, dotdot rejected, slash/backslash/null rejected at resolver level, symlink dir rejected, same-prefix sibling rejected, namespace symlink rejected by resolver, namespace symlink returns empty list, symlinks skipped in list, secret fields filtered from status",
    "Update `scripts-dashboard.md` charter: new resolver and handler entries, Loop connection added",
    "Review fixes r1: structural containment (BLOCKER), status allowlist (HIGH), events handler deferred to Module 2 (MEDIUM)",
    "Review fixes r2: namespace-root reparse-point validation — `.gator` and `loops` checked before any loop entry access; `_is_reparse_point()` replaces bare `is_symlink()` everywhere; list handler refuses to iterate when namespace root is a reparse point; loop-entry check split into pre-resolve `is_symlink()` + post-existence `_is_reparse_point()` to avoid false positives on non-existent paths",
    "Review fixes r3: missing-namespace response taxonomy — `is_dir()` existence checks before `_is_reparse_point()` calls on `.gator` and `loops` so absent namespaces return 404 (FileNotFoundError) instead of 400 (reparse-point error); two new tests for repos missing `.gator` and missing `loops` subdirectory"
  ],
  "transcript_session_id": "cb9a4c63-1bbc-404a-9255-3e500a30471b",
  "transcript_ref": null
}