{
  "schema": "gator-session-snippet-v2",
  "type": "session_snippet",
  "architect": "alan",
  "agent": "claude-opus-4-7",
  "intent": "test_packaging: reconcile pinning tests with P2.1 dispatcher verb-set (companion to 07beb97)",
  "change_type": "test",
  "significance": "routine",
  "charter_changed": true,
  "decision_tags": [
    "2.6.0",
    "test-drift",
    "p2.1-companion"
  ],
  "commit": "dbc5aeafbce1eebdab7026371099a8684d30b93a",
  "short_commit": "dbc5aea",
  "snippet_id": "snippet-dbc5aeafbce1e",
  "session_group_key": null,
  "repo": "gator",
  "branch": "dev",
  "commit_index": 1,
  "previous_commit_in_session": null,
  "started_at": "2026-08-11T00:13:04Z",
  "ended_at": "2026-08-11T00:13:04Z",
  "vendor_inferred": "anthropic",
  "model_inferred": "claude-opus-4-7",
  "machine_id": "c5c707f5-155a-422f-9b1b-d9e8a10fea08",
  "machine_label": "alan-home-desktop",
  "files_touched": [
    ".gator/charters/scripts-enterprise.md",
    "tests/test_packaging.py"
  ],
  "notes": [
    "**Test drift fixed** — `tests/test_packaging.py::TestInstalledArtifact::test_gator_enterprise_help` and `::test_gator_enterprise_all_verbs_exit_unavailable_in_base_install` were pinned to the OLD (broken) verb set (`setup/status/audit/disconnect` + `server/db/policy/org/fleet`) that P2.1 (commit `07beb97`) reconciled away. Reconciled iterations to the real verb sets: developer-side (`activate/sync/repo/transcripts/commits`) and operator/admin (`auth/repos/providers/policies/reports/machines/blocks`).",
    "**Sync-obligation notes** added in both tests noting the CLIENT/SERVER_SUBCOMMANDS surfaces in `src/gator_command/scripts/gator-enterprise.py` as the source of truth.",
    "**Discovered during**: full-suite regression before v2.6.0 RC — both tests failed on the current dispatcher's `--help` output because `status` (asserted present) is no longer advertised, and on `enterprise setup` because argparse rejects the removed verb with rc=2 rather than the expected EX_UNAVAILABLE=69.",
    "**Should have been in `07beb97`**: this test-drift fix is a P2.1 companion but wasn't caught until the full suite ran. Landing standalone now to avoid re-tagging a squash. The two failures were also enumerated in the regression evidence in Option B commit `f9d59fd`'s draft body.",
    "**Test evidence**: `tests/test_packaging.py::TestInstalledArtifact::test_gator_enterprise_help` PASS, `tests/test_packaging.py::TestInstalledArtifact::test_gator_enterprise_all_verbs_exit_unavailable_in_base_install` PASS (already verified during the regression sweep).",
    "Landing this as the final tree state at `HEAD` before the `v2.6.0-rc1` tag push."
  ],
  "transcript_session_id": null,
  "transcript_ref": null
}