{
  "schema": "gator-session-snippet-v2",
  "type": "session_snippet",
  "architect": "AG",
  "agent": "claude-fable-5",
  "intent": "runtime-split Phase 3b hardening r2: four-clause launcher chain for vendor-hook fallbacks (whiteboard 2026-08-19)",
  "change_type": "fix",
  "significance": "routine",
  "charter_changed": true,
  "decision_tags": [
    "runtime-split",
    "phase-3",
    "vendor-hooks",
    "enforcer-finding",
    "windows-launcher"
  ],
  "commit": "62e8c32d5458d076e2b0976109aa53550b701737",
  "short_commit": "62e8c32",
  "snippet_id": "snippet-62e8c32d5458d",
  "session_group_key": null,
  "repo": "gator",
  "branch": "dev",
  "commit_index": 2,
  "previous_commit_in_session": "0ead3681ae249a169fc8a52cf3d2644bff6ef173",
  "started_at": "2026-08-20T00:07:11Z",
  "ended_at": "2026-08-20T00:07:11Z",
  "vendor_inferred": "anthropic",
  "model_inferred": "claude-fable-5",
  "machine_id": "c5c707f5-155a-422f-9b1b-d9e8a10fea08",
  "machine_label": "alan-home-desktop",
  "files_touched": [
    ".claude/settings.json",
    ".codex/hooks.json",
    ".gator/.gator-version",
    ".gator/charters/scripts-repo-lifecycle.md",
    ".gator/runtime-pin.json",
    ".gator/session-snippets/2026-08-19-gator-0ead3681ae249.json",
    ".gemini/settings.json",
    "src/gator_command/templates/gator-starter/vendor-hooks/claude-settings.json",
    "src/gator_command/templates/gator-starter/vendor-hooks/codex-hooks.json",
    "src/gator_command/templates/gator-starter/vendor-hooks/gemini-settings.json",
    "tests/test_vendor_hooks.py"
  ],
  "notes": [
    "**Codex whiteboard finding applied (medium)**: the r1 shell-chain fallback hardcoded `python`, contradicting Gator's own launcher-sensitivity rule (the git-hook wrappers deliberately use `py.exe`/exact interpreter paths on Windows because `python`-on-PATH is environment-dependent). On py-launcher-only Windows source checkouts, BOTH clauses failed — the execution mode r1 meant to restore stayed broken; python3-only POSIX had the same class of gap.",
    "**Fix**: all three vendor-hook templates now ship FOUR-clause chains — `gator hook <name> || python <script> || python3 <script> || py -3 <script>` — covering pipx-installed (clause 1, zero noise in the common case), python-on-PATH, python3-only POSIX, and py-launcher-only Windows. `||` semantics identical in cmd.exe and POSIX sh. Predicate unchanged (every fallback clause carries `.gator/`). All four clauses evaporate at Phase 4 with the repo scripts.",
    "**Live-verified**: this repo's configs migrated in place (the never-duplicate contract's FOURTH generation transition); the terminal `py -3` clause exercised by simulating all three earlier clauses missing — the py launcher ran the session script, exit 0 (the exact flagged scenario).",
    "Template pins updated to assert all three fallback clauses per command (40 pass across the vendor/session hook suites).",
    "Charter `scripts-repo-lifecycle.md`: Phase 3b invariant rewritten for the four-clause chain with the launcher-rule provenance.",
    "Riding: vendor-config migrations + pin/`.gator-version` refresh + session snippet residue for `0ead368`."
  ],
  "transcript_session_id": null,
  "transcript_ref": null
}