{
  "schema": "gator-session-snippet-v2",
  "type": "session_snippet",
  "architect": "Alan Gillette",
  "agent": "claude-opus-5-5",
  "intent": "Loop: participant liveness bridge — background watcher, Dashboard liveness view, Architect Re-notify (#36)",
  "change_type": "feature",
  "significance": "high",
  "charter_changed": true,
  "decision_tags": [
    "loop",
    "liveness",
    "dashboard",
    "security",
    "governance"
  ],
  "commit": "acff663a533061937ed4c348924f8cba68daaae6",
  "short_commit": "acff663",
  "snippet_id": "snippet-acff663a53306",
  "session_group_key": null,
  "repo": "gator",
  "branch": "dev",
  "commit_index": 1,
  "previous_commit_in_session": null,
  "started_at": "2026-09-30T23:52:13Z",
  "ended_at": "2026-09-30T23:52:13Z",
  "vendor_inferred": "anthropic",
  "model_inferred": "claude-opus-5-5",
  "machine_id": "c5c707f5-155a-422f-9b1b-d9e8a10fea08",
  "machine_label": "alan-home-desktop",
  "files_touched": [
    ".claude/commands/loop-join.md",
    ".gator/.includes/procedures/gator-loop-protocol.md",
    ".gator/.includes/reference-notes/loop-participant-watcher.md",
    ".gator/charters/scripts-cross-cutting.md",
    ".gator/charters/scripts-dashboard-ui.md",
    ".gator/charters/scripts-dashboard.md",
    ".gator/charters/scripts-layout.md",
    ".gator/charters/scripts-loop.md",
    ".gator/commit_draft.md",
    ".gator/session-snippets/2026-09-29-gator-1ed0247bc147c.json",
    "CHANGELOG.md",
    "pyproject.toml",
    "src/gator_command/scripts/dashboard/dashboard.css",
    "src/gator_command/scripts/dashboard/views/loop.js",
    "src/gator_command/scripts/gator-dashboard.py",
    "src/gator_command/scripts/gator_layout.py",
    "src/gator_command/scripts/loop/cli.py",
    "src/gator_command/scripts/loop/host.py",
    "src/gator_command/scripts/loop/liveness.py",
    "src/gator_command/templates/gator-starter/commands/loop-join.md",
    "src/gator_command/templates/gator-starter/procedures/gator-loop-protocol.md",
    "src/gator_command/templates/gator-starter/reference-notes/loop-participant-watcher.md",
    "src/gator_command/templates/gator-starter/scripts/gator_layout.py",
    "tests/test_dashboard_loop_liveness.py",
    "tests/test_dashboard_ui/test_loop_liveness_ui.py",
    "tests/test_loop_liveness_cli.py",
    "tests/test_loop_liveness_lifecycle.py",
    "tests/test_loop_liveness_projection.py",
    "tests/test_loop_liveness_store.py"
  ],
  "notes": [
    "Add implementation plan for the loop participant liveness bridge (#36 remainder): `.gator/vault/artifacts/2026-09-29-loop-participant-liveness-bridge-implementation-plan.md` (rev 1, for plan review; no code changes).",
    "Revise the liveness plan to rev 2 per the whiteboard P1 finding: add D2a (the supervised background-watcher receiver contract, with Claude Code background tasks as the first supervisor and Codex deferred to a follow-on issue); add the registration lifecycle (active/released/closed); align `watch` exit codes with `wait`; add a supervised end-to-end lifecycle test (M3/M4) and receiver-contract docs (M6). Resolution noted on the whiteboard.",
    "Revise the liveness plan to rev 3 per the whiteboard re-review: add the M0 vendor spike and release gate (a version-pinned manual proof that Claude Code background Bash re-invokes an idle agent); demote Claude Code to a candidate supervisor until M0 passes; narrow the claim to an open session with an idle agent; pre-decide the experimental-adapter fallback; make the M5/M6 vendor copy conditional on M0.",
    "Run the M0 vendor spike and record it at `.gator/vault/artifacts/2026-09-29-liveness-m0-vendor-spike.md`: it passes on Claude Code 2.1.283 on Windows 10. A background Bash exit re-invoked the idle agent about 3 s later with no user input; the output is delivered as a file path. The negative control is still pending. D2a is updated with the result and the M2 single-JSON-line stdout requirement.",
    "#36 M1: add `src/gator_command/scripts/loop/liveness.py`, the private per-worktree participant-liveness store at `$(git rev-parse --git-path gator-loop-liveness)/<loop_id>.json`. It provides:",
    "a strict schema allowlist that also recursively rejects token-shaped strings;",
    "atomic writes that are LF-only, retry on Windows `PermissionError`, and never leave a temp file behind;",
    "lock-free `read()` for observers, and a `with_lock()` mutation path with a leaf lock that quarantines corrupt files instead of deleting them;"
  ],
  "transcript_session_id": null,
  "transcript_ref": null
}