{
  "schema": "gator-session-snippet-v2",
  "type": "session_snippet",
  "architect": "alan-gillette",
  "agent": "claude-opus-4-7",
  "intent": "Actually land the 2.5.2-intended fixes (were dropped from 5dcdbdd)",
  "change_type": "fix",
  "significance": "routine",
  "charter_changed": true,
  "decision_tags": [
    "hook-hardening",
    "missed-commit-recovery",
    "pre-commit-validation",
    "migrate-layout-fix"
  ],
  "commit": "657990fab012091ee45c28e85bd02bc840783678",
  "short_commit": "657990f",
  "snippet_id": "snippet-657990fab0120",
  "session_group_key": null,
  "repo": "gator",
  "branch": "dev",
  "commit_index": 9,
  "previous_commit_in_session": "8748811c164270bc65104be2b8b870dbb816b26b",
  "started_at": "2026-08-03T00:47:05Z",
  "ended_at": "2026-08-03T00:47:05Z",
  "vendor_inferred": "anthropic",
  "model_inferred": "claude-opus-4-7",
  "machine_id": "c5c707f5-155a-422f-9b1b-d9e8a10fea08",
  "machine_label": "alan-home-desktop",
  "files_touched": [
    ".gator/.includes/scripts/gator-pre-commit.py",
    ".gator/blueprints/README.md",
    ".gator/charters/INDEX.md",
    ".gator/charters/scripts-cross-cutting.md",
    ".gator/charters/scripts-repo-lifecycle.md",
    ".gator/session-snippets/2026-08-03-gator-8748811c16427.json",
    "mkdocs.yml",
    "src/gator_command/scripts/gator-update.py",
    "src/gator_command/templates/gator-starter/scripts/gator-pre-commit.py",
    "src/gator_command/templates/gator-starter/scripts/gator-update.py",
    "tests/test_layout.py",
    "tests/test_precommit_validation.py"
  ],
  "notes": [
    "Post-release audit found that commit `5dcdbdd` (\"Two hook fixes +",
    "vault 12 outdated docs\") committed only 13 files — the docs",
    "deletions (12) + one session snippet. The code + test + charter",
    "files I intended to stage were silently dropped from that commit",
    "(likely a Windows shell issue with the trailing-backslash `git add`",
    "continuation). The v2.5.2 wheel on PyPI ships a version bump + docs",
    "vault only — the \"hook hardening\" the CHANGELOG describes is",
    "absent from the wheel."
  ],
  "transcript_session_id": null,
  "transcript_ref": null
}